therion 6.1.2 (2022-07-11)
  - using Proj 9.1.1, compiled against 9.1.1
checking optional fonts csr10 csti10 csbx10 csss10 csssi10 ... OK
checking optional fonts cmcyr10 cmcti10 cmcbx10 cmcss10 cmcssi10 ... OK
configuration file: thconfig.thcfg
reading ... done
reading source files ... done
preprocessing database ... done
output coordinate system: UTM16
meridian convergence (deg): -0.1850
geomag declinations (deg):
  2023.1.1  -4.0994
  2024.1.1  -4.1605
scanning centreline tree ... done
searching for centerline loops ... done
calculating station coordinates ... done
average loop error: 1.03%
processing survey data ... 
####################### cavern log file ########################
 1> Survex 1.4.3
 2> Copyright © 1990-2021 Olly Betts
 3> 
 4> Survey contains 390 survey stations, joined by 390 shots.
 5> There are 3 loops.
 6> Survey has 3 connected components.
 7> Total length of survey shots =  201.98m ( 201.99m adjusted)
 8> Total plan length of survey shots =  200.88m
 9> Total vertical length of survey shots =    7.91m
10> Vertical range = 4.32m (from 250 at 501.38m to 22 at 497.06m)
11> North-South range = 57.83m (from 18 at 3991613.34m to 273 at 3991555.50m)
12> East-West range = 107.09m (from 18 at 528297.60m to 186 at 528190.51m)
13>  367 1-nodes.
14>    2 2-nodes.
15>    3 6-nodes.
16>    2 10-nodes.
17>    1 14-node.
18>    3 15-nodes.
19>    1 16-node.
20>    1 17-node.
21>    1 18-node.
22>    1 20-node.
23>    1 21-node.
24>    2 25-nodes.
25>    1 26-node.
26>    1 28-node.
27>    1 32-node.
28>    1 36-node.
29>    1 48-node.
30> 
######################### transcription ########################
 4> 390 : ent@survey_1 -- 390 : ent@survey_1
 5> 3 : .@survey_1
 6> 3 : .@survey_1
10> 250 : .@survey_1 -- 22 : .@survey_1
11> 18 : .@survey_1 -- 273 : .@survey_1
12> 18 : .@survey_1 -- 186 : .@survey_1
13> 367 : .@survey_1
14> 2 : .@survey_1
15> 3 : .@survey_1
16> 2 : .@survey_1
17> 1 : A1@survey_1
18> 3 : .@survey_1
19> 1 : A1@survey_1
20> 1 : A1@survey_1
21> 1 : A1@survey_1
22> 1 : A1@survey_1
23> 1 : A1@survey_1
24> 2 : .@survey_1
25> 1 : A1@survey_1
26> 1 : A1@survey_1
27> 1 : A1@survey_1
28> 1 : A1@survey_1
29> 1 : A1@survey_1
#################### end of cavern log file ####################
done
calculating basic statistics ... done
processing extended elevation ... done
processing references ... done
selecting export objects ... done
writing output/DA14 Mill Creek Cave Model.3d ... done
writing output/DA14 Mill Creek Cave Model.lox ...
processing projection plan ... done
average distortion: 0.07%
.
therion: warning -- scrap_1@survey_1 -- multiple scrap outer outlines not supported yet
 done
writing output/DA14 Mill Creek Cave KML.kml ... done


############### export maps & scraps selection #################
M   499.69 map_1@survey_1 ()
M   499.69 low@survey_1 ()
S   499.69 scrap_1@survey_1 ()
########## end of export maps & scraps selection ###############
writing output/DA14 Mill Creek Cave Plan.pdf ...
processing projection none ... done
####################### metapost log file ########################
This is MetaPost, version 2.02 (TeX Live 2022) (kpathsea version 6.3.4)  11 MAY 2023 18:55
**data.mp
(/usr/local/texlive/2022/texmf-dist/metapost/base/mpost.mp
(/usr/local/texlive/2022/texmf-dist/metapost/base/plain.mp
Preloading the plain mem file, version 1.005) ) (./data.mp
{randomseed:=42}
 [1] [2] [3] [4]
[5] [6] [7] [8] [9] [10] [11] [12] [13] [14]
[1] [2] [3] [4] [5] [6] [7] [8] [9] [10] [11] [12] [13] [14] [15] [16] [17]
[18] [19] [20] [21] [22] [23] [24] [25] [26] [27] [28] [29] (./mptextmp.mp)
[30] [31] [32] [33] [34] [35] [36] [37] [38] [39] [40] [41] [42] [43] [44]
[45] [46] [47] [48] [49] [50] [51] [52] [53] )
 
Here is how much of MetaPost's memory you used:
 18208 strings using 410292 characters
 4330656 bytes of node memory
 1878 symbolic tokens
 9i,82n,20p,665b,5f stack positions out of 16i,98n,25p,760b,6f
67 output files written: data-patt.1 .. data.53


#################### end of metapost log file ####################
converting scraps ... done
making map ... done
######################## pdftex log file #########################
This is pdfTeX, Version 3.141592653-2.6-1.40.24 (TeX Live 2022) (preloaded format=pdftex 2022.9.8)  11 MAY 2023 18:55
entering extended mode
 restricted \write18 enabled.
 %&-line parsing enabled.
**data.tex
(./data.tex (./th_enc.tex) (./th_texts.tex) (./th_resources.tex
(/usr/local/texlive/2022/texmf-dist/tex/generic/pdftex/glyphtounicode.tex))
(./th_fontdef.tex{/usr/local/texlive/2022/texmf-var/fonts/map/pdftex/updmap/pdf
tex.map})
(./th_formdef.tex) (./th_pagedef.tex (./th_legend.tex)) (./th_pages.tex)
 122 numeric registers used out of 32768

[1] ) 
Here is how much of TeX's memory you used:
 347 strings out of 494594
 4657 string characters out of 6146452
 236368 words of memory out of 5000000
 2002 multiletter control sequences out of 15000+600000
 21229 words of font info for 66 fonts, out of 8000000 for 9000
 1416 hyphenation exceptions out of 8191
 12i,5n,7p,316b,78s stack positions out of 10000i,1000n,20000p,200000b,200000s
</usr/local/texlive/2022/texmf-dist/fonts/type1/public/amsfonts/cm/cmss10.
pfb></usr/local/texlive/2022/texmf-dist/fonts/type1/public/amsfonts/cm/cmssi10.
pfb>
Output written on data.pdf (1 page, 199442 bytes).
PDF statistics:
 179 PDF objects out of 1000 (max. 8388607)
 93 compressed objects within 1 object stream
 0 named destinations out of 1000 (max. 500000)
 491 words of extra memory for PDF output out of 10000 (max. 10000000)


##################### end of pdftex log file #####################
done


############### export maps & scraps selection #################
M   499.69 map_1@survey_1 ()
M   499.69 low@survey_1 ()
S   499.69 scrap_1@survey_1 ()
########## end of export maps & scraps selection ###############
writing output/DA14 Mill Creek Cave Plan Plan.svg ...
####################### metapost log file ########################
This is MetaPost, version 2.02 (TeX Live 2022) (kpathsea version 6.3.4)  11 MAY 2023 18:55
**data.mp
(/usr/local/texlive/2022/texmf-dist/metapost/base/mpost.mp
(/usr/local/texlive/2022/texmf-dist/metapost/base/plain.mp
Preloading the plain mem file, version 1.005) ) (./data.mp
{randomseed:=42}
 [1] [2] [3] [4]
[5] [6] [7] [8] [9] [10] [11] [12] [13] [14]
[1] [2] [3] [4] [5] [6] [7] [8] [9] [10] [11] [12] [13] [14] [15] [16] [17]
[18] [19] [20] [21] [22] [23] [24] [25] [26] [27] [28] [29] (./mptextmp.mp)
[30] [31] [32] [33] [34] [35] [36] [37] [38] [39] [40] [41] [42] [43] [44]
[45] [46] [47] [48] [49] [50] [51] [52] [53] )
 
Here is how much of MetaPost's memory you used:
 18208 strings using 410292 characters
 4330656 bytes of node memory
 1878 symbolic tokens
 9i,82n,20p,665b,5f stack positions out of 16i,98n,25p,760b,6f
67 output files written: data-patt.1 .. data.53


#################### end of metapost log file ####################
converting scraps ... done
making svg map ... done
done


############### export maps & scraps selection #################
M   499.69 map_1@survey_1 ()
M   499.69 low@survey_1 ()
S   499.69 scrap_1@survey_1 ()
########## end of export maps & scraps selection ###############
writing output/DA14 Mill Creek Cave Plan Atlas.pdf ...
####################### metapost log file ########################
This is MetaPost, version 2.02 (TeX Live 2022) (kpathsea version 6.3.4)  11 MAY 2023 18:55
**data.mp
(/usr/local/texlive/2022/texmf-dist/metapost/base/mpost.mp
(/usr/local/texlive/2022/texmf-dist/metapost/base/plain.mp
Preloading the plain mem file, version 1.005) ) (./data.mp
{randomseed:=42}
 [1] [2] [3] [4]
[5] [6] [7] [8] [9] [10] [11] [12] [13] [14]
[1] [2] [3] [4] [5] [6] [7] [8] [9] [10] [11] [12] [13] [14] [15] [16] [17]
[18] [19] [20] [21] [22] [23] [24] [25] [26] [27] [28] [29] (./mptextmp.mp)
[30] [31] [32] [33] [34] [35] [36] [37] [38] [39] [40] [41] [42] [43] [44]
[45] [46] [47] [48] [49] [50] [51] [52] [53] )
 
Here is how much of MetaPost's memory you used:
 18208 strings using 410292 characters
 4330656 bytes of node memory
 1878 symbolic tokens
 9i,82n,20p,665b,5f stack positions out of 16i,98n,25p,760b,6f
67 output files written: data-patt.1 .. data.53


#################### end of metapost log file ####################
converting scraps ... done
making atlas ... done
######################## pdftex log file #########################
This is pdfTeX, Version 3.141592653-2.6-1.40.24 (TeX Live 2022) (preloaded format=pdftex 2022.9.8)  11 MAY 2023 18:55
entering extended mode
 restricted \write18 enabled.
 %&-line parsing enabled.
**data.tex
(./data.tex (./th_enc.tex) (./th_texts.tex) (./th_resources.tex
(/usr/local/texlive/2022/texmf-dist/tex/generic/pdftex/glyphtounicode.tex))
(./th_fontdef.tex{/usr/local/texlive/2022/texmf-var/fonts/map/pdftex/updmap/pdf
tex.map})
(./th_formdef.tex) (./th_pagedef.tex) (./th_pages.tex [1] [2] [3] [4] [5]
[6] [7] [8] [9] [10] [11] [12] [13] [14] [15] [16] [17] [18] [19] [20] [21]
[22] [23] [24] [25] [26] [27] [28] [29] [30] [31] [32])
 184 numeric registers used out of 32768
 (./th_legend.tex)
[33] ) 
Here is how much of TeX's memory you used:
 424 strings out of 494594
 4839 string characters out of 6146452
 236356 words of memory out of 5000000
 2049 multiletter control sequences out of 15000+600000
 21099 words of font info for 66 fonts, out of 8000000 for 9000
 1416 hyphenation exceptions out of 8191
 8i,7n,6p,270b,59s stack positions out of 10000i,1000n,20000p,200000b,200000s
</usr/local/texlive/2022/texmf-dist/fonts/type1/public/amsfonts/cm/cmss10
.pfb></usr/local/texlive/2022/texmf-dist/fonts/type1/public/amsfonts/cm/cmsy10.
pfb>
Output written on data.pdf (33 pages, 298691 bytes).
PDF statistics:
 1066 PDF objects out of 1200 (max. 8388607)
 847 compressed objects within 9 object streams
 32 named destinations out of 1000 (max. 500000)
 1053 words of extra memory for PDF output out of 10000 (max. 10000000)


##################### end of pdftex log file #####################
done
writing output/DA14 Mill Creek Cave Leads.html ... done
writing xtherion file ... done
compilation time: 2 sec


######################### loop errors ##########################
REL-ERR ABS-ERR TOTAL-L STS X-ERROR Y-ERROR Z-ERROR STATIONS
  1.03%    0.3m   30.6m   5    0.1m   -0.3m   -0.1m [A7@survey_1 - A8 - A9 - B2 - B1 - A7]
##################### end of loop errors #######################


###################### scrap distortions #######################
 PROJECTION: plan
 AVERAGE  MAXIMAL  SCRAP
   0.07%   28.80%  scrap_1@survey_1
################### end of scrap distortions ###################

############# CRS transformations chosen by PROJ ###############
  Area of Use (AoU): (-86.686, 36.069) (-86.686, 36.069)
  [LONG-LAT → LAT-LONG] AoU: [no] transformation: [axis order change (2D) + Null geographic offset from WGS 84 to WGS 84 + axis order change (2D)] definition: [proj=noop ellps=GRS80] accuracy: [0.000 m]
  [LONG-LAT → LAT-LONG] AoU: [yes] transformation: [axis order change (2D) + Null geographic offset from WGS 84 to WGS 84 + axis order change (2D)] definition: [proj=noop ellps=GRS80] accuracy: [0.000 m]
  [LONG-LAT → UTM16] AoU: [yes] transformation: [axis order change (2D) + UTM zone 16N] definition: [proj=pipeline step proj=unitconvert xy_in=deg xy_out=rad step proj=utm zone=16 ellps=WGS84] accuracy: [0.000 m]
  [LONG-LAT → EPSG:4326] AoU: [yes] transformation: [axis order change (2D) + Null geographic offset from WGS 84 to WGS 84 + axis order change (2D)] definition: [proj=noop ellps=GRS80] accuracy: [0.000 m]
  [UTM16 → LONG-LAT] AoU: [yes] transformation: [Inverse of UTM zone 16N + axis order change (2D)] definition: [proj=pipeline step inv proj=utm zone=16 ellps=WGS84 step proj=unitconvert xy_in=rad xy_out=deg] accuracy: [0.000 m]
  [UTM16 → EPSG:4326] AoU: [yes] transformation: [Inverse of UTM zone 16N + axis order change (2D)] definition: [proj=pipeline step inv proj=utm zone=16 ellps=WGS84 step proj=unitconvert xy_in=rad xy_out=deg] accuracy: [0.000 m]
  [EPSG:4326 → UTM16] AoU: [yes] transformation: [axis order change (2D) + UTM zone 16N] definition: [proj=pipeline step proj=unitconvert xy_in=deg xy_out=rad step proj=utm zone=16 ellps=WGS84] accuracy: [0.000 m]
########## end of CRS transformations chosen by PROJ ###########
